{
  "ticker": "NVDA",
  "as_of": "2026-09-05",
  "overall_status": "INVESTIGATE",
  "vetoes": [
    {
      "id": "management_or_accounting_integrity",
      "status": "PASS",
      "evidence": [
        "FY2026 10-K는 PwC의 무수정 감사의견과 내부통제 유효성 의견을 포함한다.",
        "Q2 FY2027 10-Q는 공시통제·내부통제의 중대한 변경이나 재작성 사항을 보고하지 않았다.",
        "GAAP 순이익에 포함된 대규모 지분증권 평가이익은 별도 공시됐고 회사는 이를 Non-GAAP에서 제외했다."
      ],
      "severity": "LOW",
      "confidence": 0.78,
      "resolution_needed": null
    },
    {
      "id": "external_capital_dependence",
      "status": "PASS",
      "evidence": [
        "TTM 영업현금흐름은 약 1,344억 달러이고 2026년 7월 말 현금·현금성자산 및 시장성 채무증권은 566억 달러였다.",
        "Q2에 250억 달러 채권을 발행했지만 회사의 영업 생존이 외부자본 조달에 구조적으로 의존한다는 증거는 없다.",
        "다만 일부 AI 클라우드·모델 고객의 인프라 구축은 NVIDIA의 투자·구매약정·신용지원에 의존할 수 있다."
      ],
      "severity": "MEDIUM",
      "confidence": 0.78,
      "resolution_needed": null
    },
    {
      "id": "persistent_dilution",
      "status": "PASS",
      "evidence": [
        "발행주식수는 2025년 1월 244.77억 주, 2026년 1월 243.04억 주, 2026년 7월 241.47억 주로 감소했다.",
        "H1 FY2027 SBC 40억 달러와 주식보상 세금 45억 달러를 398억 달러 자사주 매입이 상쇄했다."
      ],
      "severity": "LOW",
      "confidence": 0.78,
      "resolution_needed": null
    },
    {
      "id": "low_quality_growth",
      "status": "INVESTIGATE",
      "evidence": [
        "Q2 Data Center 매출 890억 달러는 전년 동기보다 117% 증가했고 총마진은 75%여서 제품 수요와 경제성은 강하다.",
        "동시에 NVIDIA는 AI 클라우드가 NVIDIA 인프라를 구매하면 360억 달러의 클라우드 서비스를 약정하고, 고객·모델사·금융사에 지분투자하며, 데이터센터 리스와 보증을 제공한다.",
        "AR은 반년 동안 246억 달러 증가했고 Q2 DSO는 전분기 45일에서 60일로 늘어 매출 성장의 독립적 현금회수 품질을 추가 검증해야 한다.",
        "첨부 Q2 10-Q의 공급·용량 약정 2,790억 달러와 8월 SB Energy 보증 최대 1,050억 달러를 분리해야 한다. 보증은 조건부·장기 노출이며 전액 즉시 손실도, 무위험도 아니다. 투자자산 평가이익을 반복 영업이익으로 자본화하지 않는다."
      ],
      "severity": "HIGH",
      "confidence": 0.78,
      "resolution_needed": "공급·클라우드 약정 만기/취소권, 보증 발동·회수 조건과 투자관계 고객 매출을 대조하고 고객 최종 현금창출로 수요를 검증한다."
    },
    {
      "id": "incremental_roic_collapse",
      "status": "INVESTIGATE",
      "evidence": [
        "과거 증분 영업마진과 FCF 성장은 매우 높지만 H1 FY2027 OCF 744억 달러는 영업이익 1,173억 달러보다 낮았다.",
        "공급 약정은 2026년 1월 952억 달러에서 7월 2,790억 달러로 급증했고, 회사 정의 FCF가 차감하지 않는 지분증권 매입도 H1에 424억 달러였다.",
        "대규모 장기약정의 투자수익률이 아직 관찰되지 않아 높은 과거 ROIC를 미래에 그대로 외삽할 수 없다."
      ],
      "severity": "HIGH",
      "confidence": 0.78,
      "resolution_needed": "Rubin 전환 이후 공급약정 대비 매출·총이익·현금회수, 재고충당금, 파트너 투자수익을 코호트로 확인한다."
    },
    {
      "id": "moat_shrinkage",
      "status": "PASS",
      "evidence": [
        "Blackwell Ultra 확산, 750만 명 이상의 개발자, Q2 Compute & Networking 114% 성장과 75% 총마진은 해자 확장을 지지한다.",
        "자체 ASIC, AMD·Huawei와 수출통제는 위협이지만 현재 공시에는 지속적인 경쟁우위 수축을 입증하는 매출·마진 추세가 없다."
      ],
      "severity": "MEDIUM",
      "confidence": 0.78,
      "resolution_needed": null
    },
    {
      "id": "price_requires_unrealistic_bull_case",
      "status": "PASS",
      "evidence": [
        "중앙 역산 DCF에서 현재가는 10년 매출 CAGR 약 14.2%~17.1%와 장기 FCF 마진 35%~45%를 요구한다.",
        "요구치는 공격적이나 Q2 매출 106% 성장, Q3 1,080억 달러 가이드와 플랫폼 리더십을 고려하면 비현실적인 Bull Case 이상이라고 단정할 수 없다.",
        "Base 가치 약 221달러가 현재가 227.23달러에 근접한다."
      ],
      "severity": "HIGH",
      "confidence": 0.72,
      "resolution_needed": null
    },
    {
      "id": "fatal_concentration",
      "status": "INVESTIGATE",
      "evidence": [
        "Q2 Data Center는 총매출의 약 92.5%였고 H1 FY2027 직접 고객 세 곳이 각각 총매출의 16%, 15%, 13%를 차지했다.",
        "한 AI 연구·배포 회사가 고객의 클라우드 서비스를 통해 의미 있는 간접 수요를 만들었다고 회사가 추정했다.",
        "중국 데이터센터 컴퓨팅은 Q3 가이던스에 포함되지 않아 단일 지역 충격은 현재 숫자에 일부 반영됐지만 제품·고객 집중은 여전히 높다.",
        "첨부 Q2 10-Q의 공급·용량 약정 2,790억 달러와 8월 SB Energy 보증 최대 1,050억 달러를 분리해야 한다. 보증은 조건부·장기 노출이며 전액 즉시 손실도, 무위험도 아니다. 투자자산 평가이익을 반복 영업이익으로 자본화하지 않는다."
      ],
      "severity": "HIGH",
      "confidence": 0.78,
      "resolution_needed": "공급·클라우드 약정 만기/취소권, 보증 발동·회수 조건과 투자관계 고객 매출을 대조하고 고객 최종 현금창출로 수요를 검증한다."
    },
    {
      "id": "permanent_loss_probability",
      "status": "INVESTIGATE",
      "evidence": [
        "Bear DCF 가치는 약 92달러로 현재가보다 약 60% 낮아 파산 없이도 큰 영구자본손실이 가능하다.",
        "4,220억 달러 미래약정과 최대 1,085억 달러 보증은 고객수요 둔화나 신용사건 발생 시 하방을 증폭할 수 있다.",
        "강한 현금창출과 순현금·투자자산은 단기 지급불능 가능성을 낮춘다.",
        "첨부 Q2 10-Q의 공급·용량 약정 2,790억 달러와 8월 SB Energy 보증 최대 1,050억 달러를 분리해야 한다. 보증은 조건부·장기 노출이며 전액 즉시 손실도, 무위험도 아니다. 투자자산 평가이익을 반복 영업이익으로 자본화하지 않는다."
      ],
      "severity": "HIGH",
      "confidence": 0.78,
      "resolution_needed": "공급·클라우드 약정 만기/취소권, 보증 발동·회수 조건과 투자관계 고객 매출을 대조하고 고객 최종 현금창출로 수요를 검증한다."
    }
  ]
}
